# name: test/sql/update/test_repeated_string_update.test
# description: Test repeated update of string in same segment
# group: [update]

# create aa table
statement ok con1
CREATE TABLE test (aa VARCHAR);

statement ok con1
INSERT INTO test VALUES ('hello'), ('world')

statement ok con2
BEGIN TRANSACTION;

# scan the table
query T con1
SELECT * FROM test ORDER BY aa
----
hello
world

query T con2
SELECT * FROM test ORDER BY aa
----
hello
world

# test aa number of repeated updates
statement ok con1
UPDATE test SET aa='test' WHERE aa='hello';

query T con1
SELECT * FROM test ORDER BY aa
----
test
world

statement ok con1
UPDATE test SET aa='test2' WHERE aa='world';

query T con1
SELECT * FROM test ORDER BY aa
----
test
test2

query T con2
SELECT * FROM test ORDER BY aa
----
hello
world

statement ok con2
COMMIT;

query T con1
SELECT * FROM test ORDER BY aa
----
test
test2

