# name: test/sql/update/test_update_same_string_value.test
# description: Test repeated update of string in same transaction
# group: [update]

# create aa table
statement ok
CREATE TABLE test (aa VARCHAR);

statement ok
INSERT INTO test VALUES ('hello'), ('world')

statement ok
BEGIN TRANSACTION;

statement ok
UPDATE test SET aa='test' WHERE aa='hello';

query T
SELECT * FROM test ORDER BY aa
----
test
world

statement ok
UPDATE test SET aa='test2' WHERE aa='world';

query T
SELECT * FROM test ORDER BY aa
----
test
test2

statement ok
COMMIT;

query T
SELECT * FROM test ORDER BY aa
----
test
test2

