# name: test/sql/update/test_update_mix.test
# description: Test mix of updates inserts and deletes
# group: [update]

statement ok con1
CREATE TABLE test (aa INTEGER);

statement ok con1
INSERT INTO test VALUES (1), (2), (3);

query R con1
SELECT SUM(aa) FROM test
----
6.000000

statement ok con1
BEGIN TRANSACTION

# append from con2
statement ok con2
INSERT INTO test VALUES (4), (5), (6);

query R con1
SELECT SUM(aa) FROM test
----
6.000000

query R con2
SELECT SUM(aa) FROM test
----
21.000000

# delete from con2
statement ok con2
DELETE FROM test WHERE aa < 4

query R con1
SELECT SUM(aa) FROM test
----
6.000000

query R con2
SELECT SUM(aa) FROM test
----
15.000000

# update from con2
statement ok con2
UPDATE test SET aa=aa-3

query R con1
SELECT SUM(aa) FROM test
----
6.000000

query R con2
SELECT SUM(aa) FROM test
----
6.000000

# now commit
statement ok con1
COMMIT

query R con1
SELECT SUM(aa) FROM test
----
6.000000

query R con2
SELECT SUM(aa) FROM test
----
6.000000

