# name: test/sql/insert/test_insert_type.test
# description: Test insert into from wrong type
# group: [insert]

statement ok
CREATE TABLE strings(aa VARCHAR)

statement ok
CREATE TABLE integers(ii INTEGER)

statement ok
INSERT INTO integers VALUES (3), (4), (NULL)

statement ok
INSERT INTO strings SELECT * FROM integers

query T
SELECT * FROM strings
----
3
4
NULL

statement ok
UPDATE strings SET aa=13 WHERE aa=3

query T
SELECT * FROM strings ORDER BY cast(aa AS INTEGER)
----
NULL
4
13

