# name: test/sql/types/blob/test_blob_function.test
# description: BLOB with Functions
# group: [blob]

statement ok
PRAGMA enable_verification

statement ok
CREATE TABLE blobs (b varbinary);

statement ok
INSERT INTO blobs VALUES ('a'::binary)

# conventional concat
query T
SELECT (b || 'ZZ'::varbinary)::varchar FROM blobs
----
aZZ

query T
SELECT 'abc '::varbinary || 'klm *'::varbinary || x'EFBFBD'::varbinary || 'T'::varbinary
----
616263206b6c6d202aefbfbd54

statement ok
INSERT INTO blobs VALUES ('abc '::varbinary || 'klm *'::varbinary || x'EFBFBD'::varbinary || 'T'::varbinary)

query I
SELECT COUNT(*) FROM blobs
----
2

# octet_length
query I
SELECT OCTET_LENGTH(b) FROM blobs ORDER BY 1
----
1
13

# HEX strings
statement ok
DELETE FROM blobs

statement ok
INSERT INTO blobs VALUES (x'FF'::binary)

query T
SELECT b || 'ZZ'::varbinary FROM blobs
----
ff5a5a

query T
SELECT b || x'5A5A'::varbinary FROM blobs
----
ff5a5a

# BLOB || VARCHAR is not allowed, should fail
statement error
SELECT b || '5A5A'::VARCHAR FROM blobs

# Octet Length tests
statement ok
DELETE FROM blobs

statement ok
INSERT INTO blobs VALUES (x'FF'::binary)

statement ok
INSERT INTO blobs VALUES ('FF'::varbinary)

statement ok
INSERT INTO blobs VALUES (x'55AAFF55AAFF55AAFF01'::varbinary)

statement ok
INSERT INTO blobs VALUES ('55AAFF55AAFF55AAFF01'::varbinary)

query I
SELECT OCTET_LENGTH(b) FROM blobs ORDER BY 1
----
1
2
10
20

